question,opt1,opt2,opt3,opt4,opt5,opt6,options,answer_text,answer_letter,topic
"Using two different speakers, a researcher plays infants a combination of real words in English that they've already heard, as well as ""part-words"" assembled out of other English syllables. According to the results of Saffran et al (1996), which stimuli should cause infants to look longer at a particular speaker, and why?","Infants should look longer at ""part-words"", because the transition probabilities between their syllables are lower.","Infants should look longer at ""part-words"", because the transition probabilities between their syllables are higher.","Infants should look longer at real words, because the transition probabilities between their syllables are lower.","Infants should look longer at real words, because the transition probabilities between their syllables are higher.",,,4,"Infants should look longer at ""part-words"", because the transition probabilities between their syllables are lower.",A.,Learning
Which of the following was not one of the mechanisms we discussed for segmenting words in the speech stream?,"Relying on learning biases like the ""whole-object bias"" and ""mutual exclusivity bias"".","Relying on phonotactic rules to identify which sequences are most likely to be ""legal"" words of the language.",Using transition probabilities to identify possible word boundaries.,"Using familiar words as ""anchors"" to carve up the speech stream (like the infant's own name).",,,4,"Relying on learning biases like the ""whole-object bias"" and ""mutual exclusivity bias"".",A.,Learning
"When learning new labels, there are many possible referents to which this label could refer. What is this problem sometimes called?",The Gavagai problem,The poverty of the stimulus,The word segmentation problem,The problem of abstract concepts,The challenge of nativism,,5,The Gavagai problem,A.,Learning
"Based on studies comparing human and animal learning of sequences, statistical learning is most likely:","A domain-general capacity, because animals do exhibit some evidence of statistical learning.","A domain-specific capacity, because animals do not exhibit statistical learning.","A domain-specific capacity, because animals do exhibit some evidence of statistical learning.","A domain-general capacity, because animals do not exhibit statistical learning.","An innate capacity, because computational models like GPT-3 do not display evidence of statistical learning.",,5,"A domain-general capacity, because animals do exhibit some evidence of statistical learning.",A.,Learning
"Word learning is driven by biases like ""whole-object"" bias, but is not subject to social biases like the perceived reliability of the speaker.",FALSE,TRUE,,,,,2,FALSE,A.,Learning
"The basic ""meaningful units"" in a language system are called:",Morphemes,Words,Sentences,Phonemes,Turns,,5,Morphemes,A.,Learning
"Which human learning bias is the phenomenon of ""fast mapping"" in dogs most closely associated with?",Mutual exclusivity bias,Whole-object bias,Speaker reliability bias,Iconicity bias,Morphology bias,,5,Mutual exclusivity bias,A.,Learning
Which of the following words contains a derivational affix?,Baker,Tables,Kicked,Baby,,,4,Baker,A.,Learning
What is one challenge to the purely rule-based account of morphology?,Children are able to learn irregular verbs.,"Children seem to generalize morphemes to new words they haven't seen before (e.g., ""wug"" + ""s"" = ""wugs"").","Many aspects of morphology can be described in terms of formal rules, almost like a computer program.","During language learning, children sometimes ""over-regularize"" certain verbs (e.g., they conjugate the past tense of ""go"" as ""goed"").",,,4,Children are able to learn irregular verbs.,A.,Learning
"In English, many words beginning with ""gl-"" have meanings relating to LIGHT or VISION. This appears to violate the principle of:",Arbitrariness,Compositionality,Phonaesthemes,Sound symbolism,,,4,Arbitrariness,A.,Iconicity
"According to research discussed in class, iconic words are:",More likely to be learned earlier during development.,"Extremely common, e.g., more than ~95% of the lexicon.",Harder to learn than arbitrary words.,Better suited to conveying abstract concepts than arbitrary words.,,,4,More likely to be learned earlier during development.,A.,Iconicity
"According to research discussed in class, iconic communication systems:",Display less flexibility than arbitrary communication systems.,Help scaffold our understanding of abstract concepts.,"to emerge out of more arbitrary communication systems, i.e., there is a ""drift towards iconicity"".",,,,3,Display less flexibility than arbitrary communication systems.,A.,Iconicity
Words referring to abstract concepts are not particularly common.,FALSE,TRUE,,,,,2,FALSE,A.,Iconicity